{
  "schemaVersion": "openriamap.data-release-mirror-manifest.v1",
  "releaseId": "relay-1fac8f4b0dd54030e80b",
  "cosSource": "cos://openriamap-cairn-data-1433163128/",
  "controlCommit": "0615fa140a87a62d6ab8a8a5e8107db3278507e9",
  "mirroredAt": "2026-08-12T10:27:46.119Z",
  "files": [
    {
      "path": "current/worlds/_release-set.json",
      "sha256": "e807e467f1fc7f28a655a44f4354dd495ba3a21ee9753c6989dbce4d2b09e34c"
    },
    {
      "path": "current/worlds/zth.json",
      "sha256": "61532bd212a73f888965c8e51c5bbedb4eaf935910605bbdb23fd1d2342ff1b2"
    },
    {
      "path": "releases/relay-1fac8f4b0dd54030e80b/manifests/release-manifest.json",
      "sha256": "6c3a7b55ae0f08a3c7b88985a33408e7dc6de98022c89d21ec52e411c532afd2"
    }
  ]
}
